{
  "$schema": "https://json-schema.org/draft/2020-12/schema",
  "$id": "https://raw.githubusercontent.com/Chrome71/PowerOps/main/docs/schemas/settings-validate.schema.json",
  "title": "powerops settings validate --format json",
  "description": "The JSON written by 'powerops settings validate --format json': the problems found when a deployment settings file is checked against a solution.",
  "type": "object",
  "required": ["schemaVersion", "solution", "settings", "problems"],
  "properties": {
    "schemaVersion": { "const": 1, "description": "Version of this output format." },
    "solution": { "type": "string", "description": "Unique name of the checked solution." },
    "settings": { "type": "string", "description": "The settings file path as given on the command line." },
    "problems": {
      "type": "array",
      "description": "Sorted by component type, name, kind. Empty when the file is clean.",
      "items": {
        "type": "object",
        "required": ["kind", "componentType", "name", "message"],
        "properties": {
          "kind": {
            "enum": ["missing", "extra", "duplicate", "emptyConnectionId", "emptyValue"],
            "description": "missing: in the solution, not in the file (an environment variable only when the solution has no default or current value for it). extra: in the file, not in the solution. duplicate: the name is listed more than once in the file (the first entry is the one checked). emptyConnectionId: connection reference without a ConnectionId. emptyValue: environment variable whose Value is an empty string (pac solution import rejects it), or with no value in the file and no default or current value in the solution."
          },
          "componentType": { "enum": ["environmentVariable", "connectionReference"] },
          "name": { "type": "string", "description": "Environment variable schema name or connection reference logical name." },
          "message": { "type": "string", "description": "One-line description of the problem." }
        }
      }
    }
  }
}
